ft_case_id,transaction_id,account_num,loss_dt,reported_dt,fraud_type_cd,gross_fraud_amt,merchant_credit_amt,net_fraud_amt,chargeback_amt,chargeback_cnt,total_transaction_cnt,external_status_desc,case_narrative,loss_type_desc
case_0000164,txn_00005208,acct_0003073,2026-02-19,2026-02-27,BUS,183.33,20.08,163.25,39.6,0,7,Suspicious Activity - Temporary Hold Placed,"Detected a $3,500 wire transfer to an overseas account, tied to a bust-out operation in South America.",Net
case_0000165,txn_00005242,acct_0003114,2026-03-04,2026-03-10,ATO,56.75,32.94,23.81,20.09,3,7,Fraud Case Resolved - Account Restored,"A $2,800 overseas charge from a counterfeit card in Dubai prompted an investigation into a local skimming operation.",Net
case_0000166,txn_00005313,acct_0002101,2026-01-07,2026-01-19,CNP,478.42,130.36,348.06,48.22,2,11,Fraud Suspected - Investigation Ongoing,"Investigator flagged a $2,500 transaction at a New York electronics store, linked to a counterfeit card from a stolen batch, and reported for further review.",Gross
case_0000167,txn_00005335,acct_0001490,2026-01-26,2026-02-01,LST,182.25,52.13,130.12,85.06,0,6,Confirmed Fraud - Chargeback Filed,"Fraud alert in Singapore; unauthorized online purchases totaling $1,800 made after account takeover.",Recovered
case_0000168,txn_00005392,acct_0004872,2026-03-13,2026-03-15,ATO,316.45,131.81,184.64,236.81,0,10,Confirmed Fraud - Chargeback Filed,"Uncovered $600 unauthorized online purchase of a smartphone from a retailer in the U.K., originating from a card flagged for suspicious activity.",Recovered
case_0000169,txn_00005408,acct_0002296,2026-03-31,2026-04-11,BUS,38.52,22.08,16.44,7.88,1,7,Confirmed Fraud - Chargeback Filed,"Analyzed a $2,800 luxury hotel booking in Las Vegas, suggesting possible friendly fraud due to conflicting cardholder statements.",Net
case_0000170,txn_00005420,acct_0000366,2026-02-10,2026-02-10,LST,79.25,23.98,55.27,24.88,3,10,Fraud Case Resolved - Account Restored,Fraud detected in Malaysia; unauthorized charges of $950 made after account takeover through phishing.,Recovered
case_0000171,txn_00005425,acct_0000706,2026-03-25,2026-04-10,BUS,38,14.88,23.12,33.68,1,3,Confirmed Fraud - Refund Process Initiated,"SIM swap detected in France; victim lost $2,500 in investment funds before alerting authorities.",Recovered
case_0000172,txn_00005558,acct_0000889,2026-01-30,2026-02-14,CTF,249.53,147.59,101.94,127.92,0,2,Potential Fraud - Customer Contacted,"A customer in New Jersey reported a lost card, later finding unauthorized charges totaling $400 at an online retailer based in Canada.",Net
case_0000173,txn_00005600,acct_0000463,2026-01-20,2026-01-20,CTF,47.01,20.9,26.11,20.59,2,3,Fraud Confirmed - No Chargeback Filed,"Analyzed a $2,800 luxury hotel booking in Las Vegas, suggesting possible friendly fraud due to conflicting cardholder statements.",Gross
case_0000174,txn_00005606,acct_0003630,2026-03-23,2026-03-26,FPF,441.77,256.22,185.55,164.37,2,5,Fraudulent Transaction - Account Closed,"A cardholder in Italy found a $600 unauthorized charge at a local restaurant in New York, connected to a card reported lost while traveling.",Gross
case_0000175,txn_00005634,acct_0000201,2026-02-06,2026-02-08,BUS,77.53,7.8,69.73,33.35,0,7,Confirmed Fraud - Refund Process Initiated,"Detected fraudulent $90 charge for beauty products in Italy, linked to a compromised account in a recent data breach in Canada.",Gross
case_0000176,txn_00005637,acct_0000180,2026-03-13,2026-03-26,CTF,160.72,44.94,115.78,133.84,1,6,Fraud Confirmed - No Chargeback Filed,"Investigation launched after a $4,500 purchase in Paris flagged as counterfeit; cardholder reported previous unauthorized transactions.",Gross
case_0000177,txn_00005643,acct_0003973,2026-01-28,2026-02-12,CNP,17.34,0.16,17.18,2.91,2,1,Confirmed Fraud - Chargeback Filed,"Reported $400 purchase of electronics from a U.S. retailer, traced to an overseas IP address in Nigeria, indicating potential carding activity.",Recovered
case_0000178,txn_00005647,acct_0001755,2026-03-29,2026-04-09,ATO,17.62,8.42,9.2,9.32,2,1,Confirmed Fraud - Refund Process Initiated,"A $3,000 transaction in Rome linked to a counterfeit card; investigation revealed a widespread skimming operation across Europe.",Gross
case_0000179,txn_00005670,acct_0001790,2026-03-13,2026-04-02,BUS,105.57,32.04,73.53,68.9,2,1,Fraud Review Completed - No Action Needed,"SIM swap case in Japan; fraudulent transactions worth $4,000 traced to an overseas IP address.",Gross
case_0000180,txn_00005717,acct_0003259,2026-03-31,2026-04-05,CNP,180.02,0.69,179.33,113.51,1,4,Fraud Confirmed - No Chargeback Filed,"The investigation revealed a lost card was used in a $400 online transaction from a UK website, flagged by the customer in New York.",Recovered
case_0000181,txn_00005772,acct_0003896,2026-01-04,2026-01-11,BUS,93.57,53.6,39.97,13.72,0,2,Fraud Case Resolved - Account Restored,A fraudulent charge of $800 at a casino in Las Vegas was flagged against a lost card reported by a customer visiting from Canada.,Gross
case_0000182,txn_00005781,acct_0001064,2026-03-24,2026-03-27,BUS,47.37,12.71,34.66,31.15,2,5,Confirmed Fraud - Chargeback Filed,"Identified a $2,200 purchase of tech gadgets in Singapore, connected to a bust-out operation using fake documentation.",Net
case_0000183,txn_00005964,acct_0000002,2026-02-18,2026-03-05,CTF,389.01,149,240.01,337.07,1,1,Fraud Confirmed - No Chargeback Filed,Fraud detected in Malaysia; unauthorized charges of $950 made after account takeover through phishing.,Gross
case_0000184,txn_00005983,acct_0004582,2026-02-18,2026-03-02,LST,58.56,34.48,24.08,25.92,2,7,Confirmed Fraud - Refund Process Initiated,"Found $150 charge for digital downloads on a site in Italy, originating from a stolen card in the U.S., indicating possible identity theft.",Recovered
case_0000185,txn_00005994,acct_0004822,2026-01-21,2026-02-10,FPF,30.12,10.16,19.96,10.73,0,2,Fraud Case Resolved - Account Restored,"A $2,400 skimming incident at a bank ATM in Washington D.C. led to multiple reports of unauthorized transactions from customers.",Net
case_0000186,txn_00006122,acct_0004648,2026-01-19,2026-02-02,BUS,156.16,83.31,72.85,138.69,1,3,Fraudulent Activity - Account Suspended,"Fraud alert in Russia; $2,800 stolen after an account takeover led to multiple unauthorized withdrawals.",Recovered
case_0000187,txn_00006162,acct_0003492,2026-03-24,2026-03-26,CTF,187.51,104.15,83.36,126.59,0,8,Fraud Confirmed - No Chargeback Filed,"Account takeover in Ohio; $2,500 in unauthorized purchases made using stolen credit card information.",Recovered
case_0000188,txn_00006196,acct_0002069,2026-01-01,2026-01-10,FPF,99.84,25.45,74.39,70.55,0,4,Confirmed Fraud - Chargeback Filed,"Identified unauthorized $120 transaction for food delivery service in Singapore, linked to a compromised card in a recent data breach.",Gross
case_0000189,txn_00006200,acct_0002375,2026-02-24,2026-02-28,FPF,207.87,67.99,139.88,29.02,0,7,Confirmed Fraud - Refund Process Initiated,"SIM swap detected in France; victim lost $2,500 in investment funds before alerting authorities.",Gross
case_0000190,txn_00006239,acct_0004900,2026-03-29,2026-04-13,CTF,182.09,34.89,147.2,33.83,1,7,Confirmed Fraud - Refund Process Initiated,"Account takeover in Illinois; $1,400 taken from the victim's account through unauthorized bill payments.",Net
case_0000191,txn_00006288,acct_0001878,2026-02-26,2026-03-16,CTF,83.44,7.8,75.64,66.3,1,5,Fraud Review Completed - No Action Needed,The investigation revealed a $500 transaction at a retail store in Mexico was made with a stolen card reported lost by a traveler from Texas.,Recovered
case_0000192,txn_00006293,acct_0003849,2026-02-15,2026-03-01,LST,146.09,68.44,77.65,43.57,2,8,Fraud Suspected - Investigation Ongoing,"Account takeover in Australia; $1,500 spent on gaming subscriptions after the victim's email was hacked.",Net
case_0000193,txn_00006297,acct_0004955,2026-03-03,2026-03-15,FPF,501.42,271.71,229.71,183.81,1,1,Confirmed Fraud - Chargeback Filed,"The investigation revealed a lost card was used in a $400 online transaction from a UK website, flagged by the customer in New York.",Gross
case_0000194,txn_00006360,acct_0001851,2026-02-19,2026-03-07,FPF,135.03,67.91,67.12,17.48,1,10,Fraud Investigation - Awaiting Customer Response,"After losing their card, a customer in Florida found unauthorized charges totaling $500 at multiple stores in Mexico within 48 hours.",Net
case_0000195,txn_00006424,acct_0002753,2026-01-19,2026-01-21,LST,270.61,156.09,114.52,96.74,1,3,Fraud Suspected - Investigation Ongoing,"Investigation initiated for $250 e-commerce purchase of cosmetics from an online store in Spain, traced to a compromised credit card in Mexico.",Gross
case_0000196,txn_00006460,acct_0001494,2026-03-14,2026-03-25,CNP,810.04,304.33,505.71,277.42,2,6,Fraud Alert - Transaction Declined,"Analyzed a $2,800 luxury hotel booking in Las Vegas, suggesting possible friendly fraud due to conflicting cardholder statements.",Recovered
case_0000197,txn_00006465,acct_0000682,2026-02-10,2026-02-15,FPF,384.25,151.2,233.05,7.17,1,5,Fraud Investigation - Awaiting Customer Response,"Account takeover in Colorado; $2,000 spent on airline tickets after hackers gained access through social media.",Recovered
case_0000198,txn_00006479,acct_0000841,2026-02-20,2026-03-12,LST,35.77,17.08,18.69,17.19,0,10,Confirmed Fraud - Refund Process Initiated,"A cardholder in Germany reported a lost card after noticing a $250 charge at a local bar in Miami, leading to an immediate alert.",Gross
case_0000199,txn_00006509,acct_0000977,2026-01-23,2026-02-10,LST,37.96,12.16,25.8,32.02,0,2,Suspicious Activity - Temporary Hold Placed,"Account takeover reported in California; unauthorized purchase of $2,500 made online using stolen credentials from a phishing attack.",Recovered
case_0000200,txn_00006530,acct_0002350,2026-01-19,2026-01-19,LST,535.22,6.12,529.1,186.68,2,2,Confirmed Fraud - Refund Process Initiated,"SIM swap detected in New York; fraudster accessed account and withdrew $1,200 in cash at an ATM within minutes.",Recovered
case_0000201,txn_00006554,acct_0003540,2026-02-20,2026-03-09,CNP,116.35,63.88,52.47,59.49,1,11,Fraud Investigation - Awaiting Customer Response,"Account takeover in Ohio; $2,500 in unauthorized purchases made using stolen credit card information.",Recovered
case_0000202,txn_00006576,acct_0004074,2026-01-28,2026-02-17,FPF,45.95,16.95,29,26.49,2,9,Fraud Confirmed - No Chargeback Filed,"Investigation initiated for $250 e-commerce purchase of cosmetics from an online store in Spain, traced to a compromised credit card in Mexico.",Net
case_0000203,txn_00006598,acct_0003298,2026-03-04,2026-03-16,CTF,810,257.7,552.3,178.8,0,7,Fraud Investigation - Awaiting Customer Response,"SIM swap detected in New York; fraudster accessed account and withdrew $1,200 in cash at an ATM within minutes.",Recovered
case_0000204,txn_00006611,acct_0001696,2026-01-31,2026-02-02,LST,86.39,33.38,53.01,0.44,3,4,Fraud Suspected - Investigation Ongoing,"SIM swap incident in the Netherlands; $3,500 withdrawn from ATMs after victim's phone number was hijacked.",Net
case_0000205,txn_00006641,acct_0002524,2026-03-13,2026-03-17,CNP,341.44,18.54,322.9,251.11,3,4,Fraud Suspected - Investigation Ongoing,"Fraudulent SIM swap reported in Thailand; $1,600 transferred to an unknown account within minutes.",Net
case_0000206,txn_00006676,acct_0002564,2026-03-05,2026-03-11,CNP,536.29,100.64,435.65,356.95,2,10,Confirmed Fraud - Chargeback Filed,"A stolen card was used for a $700 online purchase in Italy, with the cardholder in Chicago reporting it lost during a recent trip.",Gross
case_0000207,txn_00006693,acct_0003521,2026-02-26,2026-03-05,CTF,88.91,9.26,79.65,50.95,1,5,Confirmed Fraud - Chargeback Filed,"Reviewed a $900 charge for concert tickets in Japan, suspected to be friendly fraud as the cardholder denied the transaction.",Recovered
case_0000208,txn_00006733,acct_0001853,2026-02-22,2026-03-06,BUS,662.84,181.57,481.27,548.98,0,2,Fraud Suspected - Investigation Ongoing,"Account takeover in Colorado; $2,000 spent on airline tickets after hackers gained access through social media.",Net
case_0000209,txn_00006772,acct_0000211,2026-03-01,2026-03-06,CNP,16.86,7.49,9.37,11.57,3,5,Fraud Alert - Transaction Declined,"Fraudulent SIM swap reported in Thailand; $1,600 transferred to an unknown account within minutes.",Recovered
case_0000210,txn_00006787,acct_0002679,2026-01-08,2026-01-15,CNP,123.8,2.76,121.04,34.49,1,7,Fraudulent Transaction - Account Closed,"Detected a $5,000 fraudulent charge from an online retailer; card traced back to a skimming operation in Las Vegas.",Gross
case_0000211,txn_00006876,acct_0001969,2026-03-27,2026-04-12,BUS,1276.75,491.17,785.58,286.29,0,7,Fraudulent Transaction - Account Closed,"Investigation initiated for $250 e-commerce purchase of cosmetics from an online store in Spain, traced to a compromised credit card in Mexico.",Recovered
case_0000212,txn_00006928,acct_0001553,2026-01-02,2026-01-06,CNP,29.77,1.55,28.22,15.31,0,11,Fraud Investigation - Awaiting Customer Response,"Counterfeit card used for a $2,000 transaction in Toronto; linked to a recent phishing scam targeting local residents.",Net
case_0000213,txn_00006939,acct_0003032,2026-02-25,2026-03-04,CNP,103.48,58.9,44.58,0.51,0,2,Fraudulent Transaction - Account Closed,"Investigation opened for a $200 e-commerce transaction for luxury goods from a site in Italy, originating from a stolen card in Canada.",Gross
case_0000214,txn_00006953,acct_0003393,2026-02-04,2026-02-15,LST,764.94,143.91,621.03,160.46,0,9,Fraud Confirmed - No Chargeback Filed,A fraudulent $900 transaction at a Miami retail outlet was traced back to a skimming device found on the ATM used by several victims.,Gross
case_0000215,txn_00006956,acct_0001725,2026-03-27,2026-03-28,FPF,119.52,41.02,78.5,8.96,2,11,Fraudulent Activity - Account Suspended,"Analyzed a $2,800 luxury hotel booking in Las Vegas, suggesting possible friendly fraud due to conflicting cardholder statements.",Recovered
case_0000216,txn_00007038,acct_0003720,2026-01-25,2026-02-04,CNP,112.8,11.27,101.53,73.62,3,10,Confirmed Fraud - Refund Process Initiated,"Found $150 charge for digital downloads on a site in Italy, originating from a stolen card in the U.S., indicating possible identity theft.",Gross
case_0000217,txn_00007222,acct_0000425,2026-01-31,2026-02-13,ATO,567.33,86.47,480.86,482.65,1,1,Suspicious Activity - Temporary Hold Placed,"Examined a $700 online gaming purchase in Canada, attributed to friendly fraud with multiple disputes from the cardholder.",Gross
case_0000218,txn_00007336,acct_0002302,2026-03-13,2026-04-02,FPF,112.38,34.12,78.26,23.09,0,4,Fraudulent Transaction - Account Closed,"Account takeover in Australia; $1,500 spent on gaming subscriptions after the victim's email was hacked.",Net
case_0000219,txn_00007340,acct_0003493,2026-03-14,2026-03-28,CTF,53.97,22.17,31.8,34.72,3,8,Fraud Suspected - Investigation Ongoing,"Detected a $3,000 purchase of sporting goods in Canada, linked to a bust-out scheme with forged identification presented.",Recovered
case_0000220,txn_00007415,acct_0000396,2026-03-27,2026-04-01,FPF,50.04,1.51,48.53,12.91,3,8,Confirmed Fraud - Refund Process Initiated,"After losing their card in Italy, a customer found a $300 charge at a local cafe in New York flagged as fraudulent.",Gross
case_0000221,txn_00007431,acct_0001381,2026-02-20,2026-03-12,LST,271.45,106.68,164.77,45.39,2,9,Fraud Confirmed - No Chargeback Filed,"Identified a $4,500 withdrawal from an ATM in Dubai, connected to a bust-out scheme involving compromised personal information.",Recovered
case_0000222,txn_00007434,acct_0002667,2026-03-17,2026-03-28,FPF,105.4,2.81,102.59,32.25,0,2,Fraud Review Completed - No Action Needed,"Flagged unauthorized $120 transaction for concert tickets on a site in the Netherlands, originating from a compromised account in the U.K.",Recovered
case_0000223,txn_00007488,acct_0003959,2026-02-09,2026-02-12,CTF,33.73,19.31,14.42,0.78,2,5,Suspicious Activity - Temporary Hold Placed,"Investigated a $1,200 purchase of home appliances in Germany, linked to a suspected first-party fraud case with multiple accounts.",Net
case_0000224,txn_00007496,acct_0004818,2026-03-18,2026-04-02,CNP,2068.35,506.42,1561.93,1454.03,3,4,Fraud Review Completed - No Action Needed,"Flagged unauthorized $120 transaction for concert tickets on a site in the Netherlands, originating from a compromised account in the U.K.",Gross
case_0000225,txn_00007537,acct_0002350,2026-01-16,2026-01-22,ATO,162.35,11.56,150.79,91.06,2,10,Fraud Suspected - Investigation Ongoing,"SIM swap incident in the Netherlands; $3,500 withdrawn from ATMs after victim's phone number was hijacked.",Net
case_0000226,txn_00007621,acct_0004290,2026-02-20,2026-03-09,FPF,116.95,27.19,89.76,58.99,1,8,Fraud Review Completed - No Action Needed,Fraud detected in Malaysia; unauthorized charges of $950 made after account takeover through phishing.,Recovered
case_0000227,txn_00007633,acct_0000330,2026-01-05,2026-01-22,ATO,389.41,223.76,165.65,293.57,1,11,Fraud Suspected - Investigation Ongoing,"Fraudulent SIM swap reported in Thailand; $1,600 transferred to an unknown account within minutes.",Recovered
case_0000228,txn_00007641,acct_0004925,2026-01-27,2026-02-11,BUS,59.73,20.76,38.97,18.42,3,11,Fraud Suspected - Investigation Ongoing,"Investigated $75 e-commerce transaction for pet supplies in Brazil, associated with a cardholder's information stolen via phishing.",Gross
case_0000229,txn_00007708,acct_0002166,2026-03-21,2026-04-04,ATO,26.74,10.21,16.53,19.08,2,9,Potential Fraud - Customer Contacted,"A stolen card was used for a $700 online purchase in Italy, with the cardholder in Chicago reporting it lost during a recent trip.",Net
case_0000230,txn_00007723,acct_0000682,2026-02-19,2026-03-01,CTF,39.34,8.55,30.79,26.3,3,6,Suspicious Activity - Temporary Hold Placed,"SIM swap detected in New York; fraudster accessed account and withdrew $1,200 in cash at an ATM within minutes.",Recovered
case_0000231,txn_00007725,acct_0004600,2026-03-06,2026-03-18,BUS,282.56,10.1,272.46,136.07,0,1,Suspicious Activity - Temporary Hold Placed,"Investigated a $2,700 online furniture order in Mexico, connected to a bust-out scheme involving multiple fake identities.",Gross
case_0000232,txn_00007727,acct_0002161,2026-03-30,2026-04-07,FPF,309.94,42.74,267.2,138.18,0,2,Potential Fraud - Customer Contacted,"After losing their card in Italy, a customer found a $300 charge at a local cafe in New York flagged as fraudulent.",Net
case_0000233,txn_00007761,acct_0002566,2026-02-18,2026-03-09,CTF,540.69,86.17,454.52,271.86,2,11,Fraud Confirmed - No Chargeback Filed,SIM swap case in Ireland; $900 lost from banking account before the victim could react.,Recovered
case_0000234,txn_00007832,acct_0000788,2026-01-05,2026-01-13,BUS,210.71,9.58,201.13,125.17,1,5,Fraudulent Transaction - Account Closed,SIM swap incident in Germany; unauthorized access to banking app resulted in a $900 transfer to an overseas account.,Gross
case_0000235,txn_00007940,acct_0004332,2026-02-18,2026-02-19,ATO,37.9,13.46,24.44,1.81,2,7,Fraud Confirmed - No Chargeback Filed,"Reported $400 purchase of electronics from a U.S. retailer, traced to an overseas IP address in Nigeria, indicating potential carding activity.",Recovered
case_0000236,txn_00007950,acct_0000576,2026-02-25,2026-03-06,BUS,73.65,18.01,55.64,15.4,2,8,Suspicious Activity - Temporary Hold Placed,"A customer in Brazil flagged a $400 charge at a local supermarket as fraudulent, linked to a lost card reported during their travels.",Recovered
case_0000237,txn_00007957,acct_0002419,2026-02-19,2026-03-02,CTF,13.27,3.49,9.78,10.26,1,11,Fraud Review Completed - No Action Needed,A $650 transaction flagged as suspicious in Chicago; found to be linked to a skimming device installed on an ATM.,Gross
case_0000238,txn_00008005,acct_0001323,2026-03-13,2026-04-01,FPF,253.15,73.44,179.71,161.97,3,8,Suspicious Activity - Temporary Hold Placed,"A $350 charge at a bar in the Bahamas was linked to a stolen card reported by a traveler from New York, who lost it during the trip.",Gross
case_0000239,txn_00008011,acct_0000995,2026-03-09,2026-03-12,CTF,55.44,5.5,49.94,46.37,1,3,Fraud Case Resolved - Account Restored,"Fraudulent SIM swap in Italy; $1,200 drained from the victim’s savings account within hours of the incident.",Recovered
case_0000240,txn_00008022,acct_0003932,2026-03-14,2026-04-03,LST,97.96,48.07,49.89,83.89,0,11,Confirmed Fraud - Chargeback Filed,"SIM swap case in Japan; fraudulent transactions worth $4,000 traced to an overseas IP address.",Net
case_0000241,txn_00008055,acct_0001356,2026-02-17,2026-03-07,ATO,188.73,92.82,95.91,11.74,2,11,Suspicious Activity - Temporary Hold Placed,An unauthorized charge of $250 at a gas station in New Mexico was traced to a stolen card reported by a customer traveling in Europe.,Net
case_0000242,txn_00008065,acct_0001535,2026-01-17,2026-01-26,CNP,30.25,5.17,25.08,3.04,3,5,Fraud Confirmed - No Chargeback Filed,"Fraudulent SIM swap in Italy; $1,200 drained from the victim’s savings account within hours of the incident.",Net
case_0000243,txn_00008092,acct_0004229,2026-01-26,2026-01-26,CNP,237.82,54.26,183.56,111.34,2,10,Confirmed Fraud - Chargeback Filed,"Investigated a $1,200 purchase of home appliances in Germany, linked to a suspected first-party fraud case with multiple accounts.",Recovered
case_0000244,txn_00008100,acct_0001400,2026-02-26,2026-03-10,FPF,48.61,12.55,36.06,24.86,0,6,Fraudulent Activity - Account Suspended,"Detected $400 purchase of furniture from an online retailer in France, linked to a cardholder’s account breached in an overseas hack.",Recovered
case_0000245,txn_00008209,acct_0004123,2026-01-21,2026-01-28,BUS,19.51,8.11,11.4,5.76,3,3,Suspicious Activity - Temporary Hold Placed,"A customer in Brazil flagged a $400 charge at a local supermarket as fraudulent, linked to a lost card reported during their travels.",Net
case_0000246,txn_00008210,acct_0003661,2026-02-18,2026-02-24,CNP,138.42,74.14,64.28,89.01,0,1,Confirmed Fraud - Chargeback Filed,"Opened investigation for $300 online purchase of jewelry from a retailer in Dubai, linked to a card reported lost in Australia.",Net
case_0000247,txn_00008247,acct_0000071,2026-03-27,2026-04-08,CTF,8.84,2.46,6.38,4.77,0,11,Potential Fraud - Customer Contacted,"SIM swap incident in the Netherlands; $3,500 withdrawn from ATMs after victim's phone number was hijacked.",Recovered
case_0000248,txn_00008350,acct_0003416,2026-03-13,2026-03-13,BUS,109.24,34.25,74.99,17.84,2,6,Fraud Investigation - Awaiting Customer Response,"The cardholder in Australia discovered a $600 charge at an overseas retailer, claiming their card was lost during a recent business trip.",Net
case_0000249,txn_00008384,acct_0000294,2026-02-17,2026-02-23,BUS,14.98,5.53,9.45,2.45,3,8,Confirmed Fraud - Chargeback Filed,"Investigation opened for a $200 e-commerce transaction for luxury goods from a site in Italy, originating from a stolen card in Canada.",Gross
case_0000250,txn_00008390,acct_0002282,2026-02-09,2026-02-16,CNP,152,30.3,121.7,107.33,1,7,Confirmed Fraud - Refund Process Initiated,Fraud detected in Malaysia; unauthorized charges of $950 made after account takeover through phishing.,Net
case_0000251,txn_00008436,acct_0004203,2026-02-20,2026-03-02,BUS,698.29,63.37,634.92,591.83,2,10,Fraud Case Resolved - Account Restored,"Account takeover reported in California; unauthorized purchase of $2,500 made online using stolen credentials from a phishing attack.",Gross
case_0000252,txn_00008440,acct_0002248,2026-02-07,2026-02-25,ATO,173.22,96.05,77.17,113.19,2,7,Fraudulent Activity - Account Suspended,Account takeover in Florida; hackers purchased $500 in gift cards after intercepting account recovery emails.,Recovered
case_0000253,txn_00008445,acct_0001960,2026-01-19,2026-01-23,CTF,334.67,151.81,182.86,88.71,3,8,Fraud Case Resolved - Account Restored,"Uncovered $300 fraudulent purchase of sports tickets from a site in Mexico, traced back to a card used in a prior hack in the U.S.",Net
case_0000254,txn_00008492,acct_0000493,2026-03-04,2026-03-05,FPF,664.32,127.74,536.58,4.56,3,6,Fraud Case Resolved - Account Restored,A fraudulent charge of $600 at a clothing store in the UK was connected to a card reported lost by a customer from Florida.,Net
case_0000255,txn_00008497,acct_0003860,2026-01-22,2026-01-26,BUS,80.26,46.23,34.03,41.7,3,10,Confirmed Fraud - Chargeback Filed,"Found $150 charge for digital downloads on a site in Italy, originating from a stolen card in the U.S., indicating possible identity theft.",Recovered
case_0000256,txn_00008546,acct_0002324,2026-01-20,2026-02-01,LST,587.86,340.8,247.06,299.84,3,4,Confirmed Fraud - Chargeback Filed,A $900 charge in Amsterdam linked to a counterfeit card; associated with a major skimming incident reported by multiple victims.,Recovered
case_0000257,txn_00008588,acct_0002910,2026-01-27,2026-01-31,FPF,45.57,24.17,21.4,29.2,3,5,Fraud Case Resolved - Account Restored,"Analyzed $500 overseas purchase of software licenses from a Chinese vendor, originating from a card reported lost in France.",Gross
case_0000258,txn_00008599,acct_0004760,2026-01-21,2026-01-23,LST,91.13,46.3,44.83,42.06,0,9,Fraudulent Transaction - Account Closed,"Account takeover reported in California; unauthorized purchase of $2,500 made online using stolen credentials from a phishing attack.",Net
case_0000259,txn_00008767,acct_0000468,2026-03-11,2026-03-17,BUS,85.02,34.55,50.47,74.96,2,10,Suspicious Activity - Temporary Hold Placed,"Detected a $4,200 purchase in Berlin from a counterfeit card; linked to a recent data leak in a major retail chain.",Net
case_0000260,txn_00008787,acct_0003789,2026-02-27,2026-03-09,CTF,91.78,23.1,68.68,13.73,2,3,Confirmed Fraud - Chargeback Filed,"Found $150 charge for digital downloads on a site in Italy, originating from a stolen card in the U.S., indicating possible identity theft.",Recovered
