ft_case_id,transaction_id,account_num,loss_dt,reported_dt,fraud_type_cd,gross_fraud_amt,merchant_credit_amt,net_fraud_amt,chargeback_amt,chargeback_cnt,total_transaction_cnt,external_status_desc,case_narrative,loss_type_desc
case_0000452,txn_00013947,acct_0003953,2026-03-30,2026-03-31,BUS,157.21,39.42,117.79,83.96,0,10,Fraud Alert - Transaction Declined,"Detected a $3,000 purchase of sporting goods in Canada, linked to a bust-out scheme with forged identification presented.",Net
case_0000453,txn_00013958,acct_0001608,2026-01-25,2026-02-08,ATO,159.53,32.58,126.95,124.6,1,5,Confirmed Fraud - Chargeback Filed,A fraudulent charge of $600 at a clothing store in the UK was connected to a card reported lost by a customer from Florida.,Gross
case_0000454,txn_00014100,acct_0000739,2026-03-11,2026-03-21,FPF,20.93,3.42,17.51,4.12,0,10,Fraud Alert - Transaction Declined,"A customer reported their card lost while in Paris, later discovering a $600 charge at a luxury boutique made without their authorization.",Recovered
case_0000455,txn_00014102,acct_0004596,2026-02-25,2026-03-17,ATO,69.71,6.03,63.68,47.36,3,11,Fraud Review Completed - No Action Needed,A fraudulent $900 transaction at a Miami retail outlet was traced back to a skimming device found on the ATM used by several victims.,Gross
case_0000456,txn_00014206,acct_0003452,2026-01-15,2026-01-25,FPF,561.02,311.27,249.75,121.02,2,7,Fraud Investigation - Awaiting Customer Response,"Analyzed a $2,800 luxury hotel booking in Las Vegas, suggesting possible friendly fraud due to conflicting cardholder statements.",Gross
case_0000457,txn_00014207,acct_0004909,2026-01-30,2026-02-08,CTF,618.22,215.53,402.69,342.9,3,4,Fraud Confirmed - No Chargeback Filed,Victim in Argentina reported a SIM swap; $900 in unauthorized transactions executed before account recovery.,Recovered
case_0000458,txn_00014223,acct_0001190,2026-01-19,2026-01-19,CNP,95.69,15.15,80.54,16.22,1,8,Fraud Case Resolved - Account Restored,"Uncovered a $1,000 charge for digital subscriptions in Australia, traced back to a bust-out operation using false identification.",Net
case_0000459,txn_00014519,acct_0003685,2026-01-03,2026-01-10,CTF,298.32,56.25,242.07,217.66,1,11,Fraud Investigation - Awaiting Customer Response,"Uncovered $300 fraudulent purchase of sports tickets from a site in Mexico, traced back to a card used in a prior hack in the U.S.",Net
case_0000460,txn_00014573,acct_0002200,2026-01-19,2026-01-19,CTF,122.96,38.5,84.46,8.81,2,4,Fraud Investigation - Awaiting Customer Response,"Identified unauthorized $80 e-commerce transaction for clothing in Canada, originating from a card linked to a known fraud ring in the U.S.",Recovered
case_0000461,txn_00014579,acct_0003381,2026-03-14,2026-03-19,ATO,59.96,12.59,47.37,28.03,2,6,Fraud Review Completed - No Action Needed,"Detected a $3,000 purchase of sporting goods in Canada, linked to a bust-out scheme with forged identification presented.",Recovered
case_0000462,txn_00014596,acct_0001434,2026-03-14,2026-03-31,FPF,237.4,111.54,125.86,211.76,2,7,Fraud Alert - Transaction Declined,"Investigated a $2,200 fraudulent purchase in Madrid, linked to counterfeit cards distributed through an underground network.",Gross
case_0000463,txn_00014623,acct_0002168,2026-02-01,2026-02-09,FPF,148.45,68.26,80.19,120.01,1,7,Fraud Investigation - Awaiting Customer Response,"Investigated $75 e-commerce transaction for pet supplies in Brazil, associated with a cardholder's information stolen via phishing.",Net
case_0000464,txn_00014655,acct_0002100,2026-01-20,2026-02-08,CTF,105.03,24.25,80.78,15.87,3,11,Fraud Review Completed - No Action Needed,"Account takeover reported in California; unauthorized purchase of $2,500 made online using stolen credentials from a phishing attack.",Gross
case_0000465,txn_00014663,acct_0000964,2026-01-01,2026-01-02,CNP,129.15,19.86,109.29,32.18,1,4,Confirmed Fraud - Refund Process Initiated,"Analyzed a $2,800 luxury hotel booking in Las Vegas, suggesting possible friendly fraud due to conflicting cardholder statements.",Net
case_0000466,txn_00014675,acct_0002080,2026-03-12,2026-03-18,CTF,53.67,27.92,25.75,23.91,1,9,Fraudulent Activity - Account Suspended,"A $1,250 skimming incident at a convenience store in Texas was confirmed, leading to the discovery of compromised customer data.",Net
case_0000467,txn_00014700,acct_0000181,2026-01-16,2026-01-28,ATO,310.77,131.96,178.81,19.88,1,9,Suspicious Activity - Temporary Hold Placed,"Detected $500 online purchase for home appliances from a retailer in Germany, originating from a card reported stolen in Canada.",Net
case_0000468,txn_00014711,acct_0002659,2026-03-20,2026-03-26,CTF,398.72,152.06,246.66,228.99,3,10,Fraud Suspected - Investigation Ongoing,"Uncovered $60 unauthorized online transaction for gaming credits in Japan, associated with a cardholder's account breached in a phishing scam.",Recovered
case_0000469,txn_00014773,acct_0001207,2026-02-18,2026-03-03,BUS,313.24,32.35,280.89,105.76,3,2,Fraud Case Resolved - Account Restored,"A $3,000 transaction in Rome linked to a counterfeit card; investigation revealed a widespread skimming operation across Europe.",Net
case_0000470,txn_00014777,acct_0003849,2026-03-14,2026-03-29,CNP,77.06,1.03,76.03,51.11,2,9,Fraud Case Resolved - Account Restored,"Detected a $3,000 purchase of sporting goods in Canada, linked to a bust-out scheme with forged identification presented.",Recovered
case_0000471,txn_00014827,acct_0001146,2026-03-14,2026-03-19,CNP,508.39,194.32,314.07,453.34,1,8,Fraud Alert - Transaction Declined,"Detected $500 online purchase for home appliances from a retailer in Germany, originating from a card reported stolen in Canada.",Recovered
case_0000472,txn_00014859,acct_0002314,2026-03-05,2026-03-20,CNP,111.2,57.38,53.82,52.36,0,5,Fraud Review Completed - No Action Needed,"Found $150 charge for digital downloads on a site in Italy, originating from a stolen card in the U.S., indicating possible identity theft.",Net
case_0000473,txn_00014873,acct_0000659,2026-03-30,2026-04-04,LST,61.76,25.22,36.54,16.61,1,9,Fraudulent Activity - Account Suspended,"Victim in Chile reported account takeover; $1,200 in digital currency stolen through compromised credentials.",Gross
case_0000474,txn_00014926,acct_0000716,2026-01-15,2026-01-19,CNP,41.89,8.25,33.64,19.43,3,5,Potential Fraud - Customer Contacted,A $650 transaction flagged as suspicious in Chicago; found to be linked to a skimming device installed on an ATM.,Net
case_0000475,txn_00014932,acct_0000051,2026-03-21,2026-04-02,LST,313.78,73.91,239.87,225.55,0,9,Confirmed Fraud - Refund Process Initiated,SIM swap incident in Germany; unauthorized access to banking app resulted in a $900 transfer to an overseas account.,Gross
case_0000476,txn_00014977,acct_0003210,2026-01-20,2026-01-23,CTF,12.6,1.75,10.85,10.56,3,7,Fraud Investigation - Awaiting Customer Response,"SIM swap detected in New York; fraudster accessed account and withdrew $1,200 in cash at an ATM within minutes.",Net
case_0000477,txn_00014992,acct_0002234,2026-01-21,2026-01-27,ATO,1564.42,5.04,1559.38,833.42,0,5,Potential Fraud - Customer Contacted,"A stolen card was used for a $900 purchase at a tech store in Japan, reported lost by a traveler from San Francisco.",Recovered
case_0000478,txn_00015067,acct_0004516,2026-02-19,2026-02-22,CNP,765.87,351.23,414.64,638.04,3,2,Fraud Case Resolved - Account Restored,"Fraud detected in Russia; $1,000 stolen from a credit card following an account takeover.",Net
case_0000479,txn_00015072,acct_0004710,2026-03-13,2026-04-01,FPF,116.04,15.86,100.18,92.28,1,6,Fraud Alert - Transaction Declined,"Detected unauthorized online purchase of $150 from an electronics retailer in Germany, linked to a compromised account in the U.S.",Gross
case_0000480,txn_00015088,acct_0003294,2026-03-14,2026-03-23,LST,22.55,10.13,12.42,0.81,0,11,Fraud Investigation - Awaiting Customer Response,"SIM swap case in Spain; $2,200 lost to fraudulent investment scheme after access gained to personal accounts.",Recovered
case_0000481,txn_00015100,acct_0003528,2026-02-17,2026-02-17,ATO,33.2,16.17,17.03,3.05,1,10,Suspicious Activity - Temporary Hold Placed,"Uncovered a $1,500 charge for online gaming subscriptions in South Korea, attributed to a friendly fraud case with numerous disputes.",Recovered
case_0000482,txn_00015138,acct_0001104,2026-02-20,2026-03-09,LST,169.32,2.56,166.76,82.83,0,11,Potential Fraud - Customer Contacted,"After losing their card in Italy, a customer found a $300 charge at a local cafe in New York flagged as fraudulent.",Recovered
case_0000483,txn_00015139,acct_0001490,2026-03-17,2026-03-17,FPF,393.91,96.49,297.42,14.74,2,11,Fraud Review Completed - No Action Needed,"Account takeover in Australia; $1,500 spent on gaming subscriptions after the victim's email was hacked.",Recovered
case_0000484,txn_00015205,acct_0002110,2026-01-25,2026-02-14,LST,32.31,17.64,14.67,18.3,3,3,Fraud Investigation - Awaiting Customer Response,A fraudulent charge of $150 at a gas station in Texas was linked to a stolen card reported by the owner from an overseas vacation.,Gross
case_0000485,txn_00015235,acct_0000655,2026-03-04,2026-03-13,CTF,81.45,21.49,59.96,18.35,3,5,Fraudulent Activity - Account Suspended,"Investigation initiated for $250 e-commerce purchase of cosmetics from an online store in Spain, traced to a compromised credit card in Mexico.",Gross
case_0000486,txn_00015236,acct_0002714,2026-02-19,2026-03-06,FPF,145.01,21.65,123.36,109.71,3,5,Fraud Suspected - Investigation Ongoing,"Investigation initiated for $250 charge on travel site in New Zealand, originating from a card reported lost in the U.K.",Recovered
case_0000487,txn_00015263,acct_0003853,2026-03-26,2026-04-04,ATO,119.63,7.21,112.42,104.01,2,7,Fraud Case Resolved - Account Restored,"Reported $400 purchase of electronics from a U.S. retailer, traced to an overseas IP address in Nigeria, indicating potential carding activity.",Net
case_0000488,txn_00015266,acct_0002419,2026-01-06,2026-01-17,CTF,345.02,203.25,141.77,85.19,1,3,Potential Fraud - Customer Contacted,"A $1,250 skimming incident at a convenience store in Texas was confirmed, leading to the discovery of compromised customer data.",Gross
case_0000489,txn_00015284,acct_0004127,2026-03-31,2026-04-14,ATO,86.55,33.48,53.07,27.27,0,1,Fraudulent Transaction - Account Closed,"Account takeover in Virginia; $1,600 taken via unauthorized credit card purchases after successful phishing attack.",Net
case_0000490,txn_00015285,acct_0003422,2026-03-14,2026-04-02,BUS,63.92,38.31,25.61,2.89,0,10,Fraudulent Transaction - Account Closed,"Account takeover reported in California; unauthorized purchase of $2,500 made online using stolen credentials from a phishing attack.",Recovered
case_0000491,txn_00015306,acct_0000221,2026-01-21,2026-02-02,CTF,379.14,183.57,195.57,279.29,1,3,Fraudulent Activity - Account Suspended,"Case in Portugal; account takeover allowed scammers to purchase $3,000 worth of luxury watches online.",Net
case_0000492,txn_00015308,acct_0001701,2026-01-19,2026-01-22,CTF,104.6,26.54,78.06,18.98,2,6,Fraud Suspected - Investigation Ongoing,"A stolen card was used for a $700 online purchase in Italy, with the cardholder in Chicago reporting it lost during a recent trip.",Gross
case_0000493,txn_00015411,acct_0000520,2026-03-29,2026-03-31,ATO,71.48,35.41,36.07,9.53,1,11,Fraudulent Transaction - Account Closed,"Found unauthorized $450 purchase of luxury handbags from a site in France, linked to a card involved in multiple overseas transactions.",Recovered
case_0000494,txn_00015518,acct_0001880,2026-02-19,2026-02-21,CNP,303.48,126.85,176.63,223.01,3,2,Fraudulent Transaction - Account Closed,"Uncovered $60 unauthorized online transaction for gaming credits in Japan, associated with a cardholder's account breached in a phishing scam.",Recovered
case_0000495,txn_00015540,acct_0001117,2026-01-19,2026-01-30,BUS,94.41,42.41,52,0.85,1,11,Fraud Review Completed - No Action Needed,"A $1,500 transaction at a restaurant in San Francisco was flagged; linked to a skimming device found in an outdoor payment terminal.",Net
case_0000496,txn_00015541,acct_0003588,2026-02-18,2026-03-06,CNP,119.65,64.19,55.46,105.8,2,10,Potential Fraud - Customer Contacted,"Analyzed a $2,800 luxury hotel booking in Las Vegas, suggesting possible friendly fraud due to conflicting cardholder statements.",Net
case_0000497,txn_00015548,acct_0001771,2026-02-19,2026-03-02,LST,133.35,71.53,61.82,54.11,1,10,Potential Fraud - Customer Contacted,Fraud case in South Africa; account takeover led to $650 in online shopping before detection.,Recovered
case_0000498,txn_00015556,acct_0002346,2026-02-19,2026-02-23,LST,45.74,6.75,38.99,2.23,1,6,Fraudulent Transaction - Account Closed,"A customer in Texas reported a $500 charge at an online marketplace as fraudulent, related to a card lost during an overseas trip.",Recovered
case_0000499,txn_00015607,acct_0004617,2026-01-30,2026-02-06,FPF,42.39,8.13,34.26,0.38,3,4,Potential Fraud - Customer Contacted,Victim in Saudi Arabia reported a SIM swap; $800 drained via online banking transactions.,Recovered
case_0000500,txn_00015618,acct_0003517,2026-02-20,2026-03-04,FPF,176.72,17.5,159.22,80.79,0,8,Confirmed Fraud - Refund Process Initiated,"Uncovered $600 unauthorized online purchase of a smartphone from a retailer in the U.K., originating from a card flagged for suspicious activity.",Gross
case_0000501,txn_00015689,acct_0000218,2026-03-14,2026-03-15,CTF,229.16,44.07,185.09,140.3,0,4,Fraud Case Resolved - Account Restored,"Uncovered a $1,500 charge for online gaming subscriptions in South Korea, attributed to a friendly fraud case with numerous disputes.",Recovered
case_0000502,txn_00015701,acct_0002244,2026-01-20,2026-02-04,LST,226.07,116.68,109.39,200.47,2,8,Potential Fraud - Customer Contacted,"Investigated $250 online transaction for health supplements from a retailer in India, linked to a card that was recently involved in a data breach.",Recovered
case_0000503,txn_00015727,acct_0003899,2026-01-09,2026-01-18,CNP,178.71,14.32,164.39,6.48,2,9,Fraud Alert - Transaction Declined,"Detected a $4,200 purchase in Berlin from a counterfeit card; linked to a recent data leak in a major retail chain.",Recovered
case_0000504,txn_00015728,acct_0003399,2026-01-18,2026-02-01,CNP,260.68,100.23,160.45,90.8,1,3,Fraud Suspected - Investigation Ongoing,"Investigation initiated for $250 charge on travel site in New Zealand, originating from a card reported lost in the U.K.",Net
case_0000505,txn_00015740,acct_0004937,2026-03-17,2026-03-30,FPF,367.48,206.24,161.24,303.95,1,7,Potential Fraud - Customer Contacted,"Detected $500 online purchase for home appliances from a retailer in Germany, originating from a card reported stolen in Canada.",Recovered
case_0000506,txn_00015759,acct_0002822,2026-01-20,2026-02-06,CNP,172.1,69.37,102.73,107.17,2,5,Confirmed Fraud - Refund Process Initiated,"Uncovered a $1,500 charge for online gaming subscriptions in South Korea, attributed to a friendly fraud case with numerous disputes.",Gross
case_0000507,txn_00015796,acct_0001983,2026-01-15,2026-01-15,LST,30.5,2.94,27.56,0.13,3,10,Fraud Investigation - Awaiting Customer Response,"A $1,250 skimming incident at a convenience store in Texas was confirmed, leading to the discovery of compromised customer data.",Gross
case_0000508,txn_00015831,acct_0003035,2026-01-19,2026-01-19,ATO,141.69,59.23,82.46,88.6,0,7,Fraud Case Resolved - Account Restored,Victim in Argentina reported a SIM swap; $900 in unauthorized transactions executed before account recovery.,Net
case_0000509,txn_00015842,acct_0000858,2026-03-13,2026-03-27,LST,252.32,137.83,114.49,110.52,0,7,Fraud Alert - Transaction Declined,"Investigation opened for a $200 e-commerce transaction for luxury goods from a site in Italy, originating from a stolen card in Canada.",Recovered
case_0000510,txn_00015855,acct_0003032,2026-01-15,2026-01-15,BUS,106.58,13.57,93.01,80.09,3,3,Fraud Alert - Transaction Declined,"Investigator flagged a $3,300 online purchase from a counterfeit card; linked to a skimming operation in a neighboring state.",Recovered
case_0000511,txn_00015881,acct_0000275,2026-01-20,2026-01-20,CTF,28.76,7.03,21.73,11.81,2,8,Potential Fraud - Customer Contacted,Detected a $600 skimming incident at a hotel in Las Vegas; several guests reported unauthorized transactions on their accounts.,Net
case_0000512,txn_00015954,acct_0002420,2026-03-02,2026-03-12,CNP,767.53,40.18,727.35,37.45,3,6,Suspicious Activity - Temporary Hold Placed,"A customer in Texas reported a $500 charge at an online marketplace as fraudulent, related to a card lost during an overseas trip.",Recovered
case_0000513,txn_00015999,acct_0002997,2026-02-20,2026-03-07,BUS,18.54,3.09,15.45,4.6,3,10,Fraudulent Activity - Account Suspended,"Uncovered $175 purchase of sports equipment from an e-commerce site in Australia, associated with a credit card reported stolen in the U.S.",Gross
case_0000514,txn_00016014,acct_0002919,2026-01-07,2026-01-22,CTF,69.15,10.55,58.6,34.3,3,6,Fraud Alert - Transaction Declined,"A $1,100 transaction in Seattle was flagged as counterfeit; related to a skimming device discovered on a local ATM.",Gross
case_0000515,txn_00016147,acct_0001961,2026-03-14,2026-03-31,LST,46.57,25.27,21.3,14.29,3,5,Potential Fraud - Customer Contacted,"Fraud detected in Russia; $1,000 stolen from a credit card following an account takeover.",Net
case_0000516,txn_00016179,acct_0004795,2026-03-21,2026-03-25,ATO,131.23,30.65,100.58,27.99,3,11,Fraudulent Transaction - Account Closed,"SIM swap case in Japan; fraudulent transactions worth $4,000 traced to an overseas IP address.",Recovered
case_0000517,txn_00016208,acct_0003958,2026-01-20,2026-02-07,BUS,453.56,50.04,403.52,64.82,1,5,Potential Fraud - Customer Contacted,"A $1,200 purchase at a luxury goods website was flagged as fraudulent, linked to a stolen card reported by a resident in New York.",Recovered
case_0000518,txn_00016224,acct_0000973,2026-02-18,2026-03-09,ATO,90.36,8.95,81.41,29.64,0,9,Fraud Case Resolved - Account Restored,"Investigated a $2,500 online purchase of electronics from a suspected bust-out scheme in California, using stolen identity information.",Net
case_0000519,txn_00016243,acct_0003497,2026-03-29,2026-04-18,CNP,45.84,16.22,29.62,16.68,1,7,Fraud Alert - Transaction Declined,"After losing their card in Italy, a customer found a $300 charge at a local cafe in New York flagged as fraudulent.",Net
case_0000520,txn_00016311,acct_0004326,2026-03-23,2026-04-04,BUS,181.68,30.3,151.38,60.55,3,5,Fraud Review Completed - No Action Needed,A fraudulent charge of $150 at a gas station in Texas was linked to a stolen card reported by the owner from an overseas vacation.,Recovered
case_0000521,txn_00016382,acct_0004375,2026-01-20,2026-01-23,ATO,249.06,89.13,159.93,28.21,2,1,Suspicious Activity - Temporary Hold Placed,"Flagged fraudulent $75 subscription renewal on a streaming service in Australia, traced back to a card used in a recent data breach.",Recovered
case_0000522,txn_00016418,acct_0003228,2026-03-04,2026-03-11,FPF,258.49,57.14,201.35,191.93,2,11,Fraud Investigation - Awaiting Customer Response,"Investigation into a $2,000 online purchase revealed the use of a counterfeit card traced to a skimming incident in Miami.",Net
case_0000523,txn_00016446,acct_0000174,2026-02-17,2026-02-25,LST,87.27,51.22,36.05,75.03,2,8,Confirmed Fraud - Chargeback Filed,"Account takeover in Colorado; $2,000 spent on airline tickets after hackers gained access through social media.",Gross
case_0000524,txn_00016476,acct_0001953,2026-01-21,2026-02-08,LST,59.39,23.24,36.15,17.64,3,6,Potential Fraud - Customer Contacted,"The investigation revealed a lost card was used in a $400 online transaction from a UK website, flagged by the customer in New York.",Recovered
case_0000525,txn_00016481,acct_0003150,2026-02-26,2026-03-17,CTF,659.05,196.5,462.55,236.06,3,8,Fraud Investigation - Awaiting Customer Response,"A $1,700 transaction in Lisbon traced back to counterfeit cards; investigation revealed a local syndicate involved in skimming activities.",Recovered
case_0000526,txn_00016522,acct_0000927,2026-01-19,2026-02-03,ATO,89.52,34.98,54.54,28.51,0,5,Fraud Suspected - Investigation Ongoing,"A $2,800 overseas charge from a counterfeit card in Dubai prompted an investigation into a local skimming operation.",Gross
case_0000527,txn_00016524,acct_0003431,2026-01-21,2026-01-23,LST,177.5,24.76,152.74,124.67,2,11,Suspicious Activity - Temporary Hold Placed,A cardholder in Arizona discovered a $300 transaction at a local gym linked to a stolen card reported after losing it during a night out.,Recovered
case_0000528,txn_00016549,acct_0003640,2026-02-04,2026-02-04,LST,69.28,26.87,42.41,58.22,3,1,Confirmed Fraud - Chargeback Filed,"A $2,800 overseas charge from a counterfeit card in Dubai prompted an investigation into a local skimming operation.",Net
case_0000529,txn_00016550,acct_0000748,2026-03-23,2026-03-25,FPF,169.58,58.6,110.98,46.6,2,4,Confirmed Fraud - Refund Process Initiated,"A $350 charge at a bar in the Bahamas was linked to a stolen card reported by a traveler from New York, who lost it during the trip.",Net
case_0000530,txn_00016564,acct_0003110,2026-01-20,2026-01-31,CTF,51.91,22.53,29.38,38.79,2,8,Fraud Confirmed - No Chargeback Filed,"Uncovered $60 unauthorized online transaction for gaming credits in Japan, associated with a cardholder's account breached in a phishing scam.",Gross
case_0000531,txn_00016575,acct_0000343,2026-02-03,2026-02-13,FPF,190.25,27.6,162.65,39.91,0,8,Fraud Case Resolved - Account Restored,"Investigation launched after a $3,600 overseas purchase in Hong Kong flagged as counterfeit; card traced back to a data breach.",Gross
case_0000532,txn_00016590,acct_0000733,2026-01-03,2026-01-05,LST,192.5,34.76,157.74,60.57,3,11,Fraudulent Transaction - Account Closed,"Detected a $4,200 purchase in Berlin from a counterfeit card; linked to a recent data leak in a major retail chain.",Recovered
case_0000533,txn_00016619,acct_0003160,2026-03-11,2026-03-30,CNP,92.86,4.86,88,23.61,2,1,Confirmed Fraud - Refund Process Initiated,"Account takeover in Illinois; $1,400 taken from the victim's account through unauthorized bill payments.",Recovered
case_0000534,txn_00016628,acct_0003514,2026-03-09,2026-03-17,FPF,21.32,7.31,14.01,1.51,1,6,Potential Fraud - Customer Contacted,"Detected a $1,000 luxury watch purchase from a dealer in Switzerland, originating from a card flagged for suspicious overseas activity.",Recovered
case_0000535,txn_00016681,acct_0001261,2026-02-14,2026-02-19,CTF,1138.31,183.72,954.59,318.51,3,4,Fraud Confirmed - No Chargeback Filed,"A cardholder in Italy found a $600 unauthorized charge at a local restaurant in New York, connected to a card reported lost while traveling.",Net
case_0000536,txn_00016682,acct_0003878,2026-03-14,2026-03-23,ATO,92.36,9.75,82.61,47.09,2,3,Confirmed Fraud - Refund Process Initiated,"The investigation revealed a stolen card was used for a $150 purchase at a bookstore in New York, reported lost by the owner in Florida.",Recovered
case_0000537,txn_00016746,acct_0004091,2026-01-27,2026-02-09,BUS,137.81,64.88,72.93,1.1,3,10,Fraudulent Activity - Account Suspended,"A cardholder in Florida flagged a $700 transaction in a local shop as fraudulent, linked to a card reported lost while vacationing in the Bahamas.",Recovered
case_0000538,txn_00016805,acct_0003434,2026-03-29,2026-04-05,CTF,60.29,14.3,45.99,13.67,2,5,Fraud Confirmed - No Chargeback Filed,"Analyzed $500 overseas purchase of software licenses from a Chinese vendor, originating from a card reported lost in France.",Recovered
case_0000539,txn_00016817,acct_0003953,2026-01-14,2026-01-15,ATO,263.9,74.89,189.01,23.46,1,6,Suspicious Activity - Temporary Hold Placed,"Identified a $2,200 purchase of tech gadgets in Singapore, connected to a bust-out operation using fake documentation.",Recovered
case_0000540,txn_00016889,acct_0002127,2026-03-26,2026-04-13,BUS,49.18,7.1,42.08,12.14,2,11,Fraudulent Activity - Account Suspended,"Investigation initiated for $250 e-commerce purchase of cosmetics from an online store in Spain, traced to a compromised credit card in Mexico.",Gross
case_0000541,txn_00016947,acct_0004980,2026-02-11,2026-02-21,ATO,617.88,143.35,474.53,28.25,3,2,Fraud Alert - Transaction Declined,"A stolen card was used for a $700 online purchase in Italy, with the cardholder in Chicago reporting it lost during a recent trip.",Recovered
case_0000542,txn_00016949,acct_0002142,2026-03-24,2026-04-05,FPF,178.56,89.63,88.93,58.22,3,3,Fraud Confirmed - No Chargeback Filed,"A $1,100 transaction in Melbourne confirmed as fraudulent; linked to a skimming device found at a popular shopping precinct.",Gross
case_0000543,txn_00016966,acct_0000756,2026-02-17,2026-03-02,CNP,343.82,174.2,169.62,15.14,0,2,Fraudulent Activity - Account Suspended,"Investigation launched after a $3,600 overseas purchase in Hong Kong flagged as counterfeit; card traced back to a data breach.",Recovered
case_0000544,txn_00016976,acct_0004995,2026-03-26,2026-04-09,FPF,188.98,34.46,154.52,31.11,0,10,Fraud Case Resolved - Account Restored,"Victim in Chile reported account takeover; $1,200 in digital currency stolen through compromised credentials.",Net
case_0000545,txn_00017009,acct_0003992,2026-02-17,2026-03-03,CNP,275.66,154.37,121.29,138.62,2,8,Fraud Review Completed - No Action Needed,"A $1,200 purchase at a luxury goods website was flagged as fraudulent, linked to a stolen card reported by a resident in New York.",Recovered
case_0000546,txn_00017011,acct_0001681,2026-03-04,2026-03-23,BUS,86.79,39.88,46.91,23.91,3,11,Fraud Confirmed - No Chargeback Filed,A customer in Canada reported a stolen card used for a $250 purchase at a local electronics store after losing it during a trip.,Gross
